{
  "$schema": "../../schema/school-calendar.schema.json",
  "calendar": "school-aefe",
  "schoolYear": "2026-2027",
  "sourceUrl": "https://www.efmaroc.org/efm/wp-content/uploads/2023/02/Calendrier-2026-2027-signe-v3.pdf",
  "decisionRefs": [
    {
      "ref": "Calendrier de l’année scolaire 2026/2027 — Ambassade de France au Maroc, SCAC (Rabat, 1er juin 2026)",
      "kind": "embassy-calendar"
    }
  ],
  "issuedAt": "2026-06-01",
  "classesStart": "2026-09-02",
  "classesEnd": "2027-07-02",
  "breaks": [
    {
      "id": "autumn-break",
      "labels": { "ar": "عطلة الخريف", "fr": "Vacances d’automne", "en": "Autumn break" },
      "start": "2026-10-18",
      "end": "2026-11-01",
      "sourceText": "Du samedi 17 octobre 2026 après les cours au lundi 2 novembre 2026 au matin"
    },
    {
      "id": "christmas-break",
      "labels": { "ar": "عطلة عيد الميلاد", "fr": "Vacances de Noël", "en": "Christmas break" },
      "start": "2026-12-20",
      "end": "2027-01-03",
      "sourceText": "Du samedi 19 décembre 2026 après les cours au lundi 4 janvier 2027 au matin"
    },
    {
      "id": "winter-break",
      "labels": { "ar": "عطلة الشتاء", "fr": "Vacances d’hiver", "en": "Winter break" },
      "start": "2027-02-21",
      "end": "2027-03-07",
      "sourceText": "Du samedi 20 février 2027 après les cours au lundi 8 mars 2027 au matin"
    },
    {
      "id": "spring-break",
      "labels": { "ar": "عطلة الربيع", "fr": "Vacances de printemps", "en": "Spring break" },
      "start": "2027-04-25",
      "end": "2027-05-09",
      "sourceText": "Du samedi 24 avril 2027 après les cours au lundi 10 mai 2027 au matin"
    }
  ]
}
